,created_utc,author,score,title,selftext
9,2017-10-21,themarketline,2,Enterprising Cloud and Network Communication,"I'm particularly interested in the future of cloud computing and IT infrastructures. As we become more mobile and everything from phones to juicers have internet capabilities, my belief the cloud will become a core backbone for these products. This is an obvious trend as major players like Amazon, Cisco, and IBM have already begun providing such services. 

Are there any smaller public companies that have a similar business model as Masergy (https://www.masergy.com)? Masergy is a communications company which provides hybrid networking, cloud communications, and cyber security. 

In parallel, the IT infrastructure most likely will need to be upgraded which will probably result in a rise of data centers. Are there any public companies out there that have a interesting or bright future in providing data center services?

 



"
10,2017-11-02,gaboonzoom,74,"Alibaba beats by $0.26, beats on revenue, raises guidance","Some numbers:

Revenue was RMB55,122 million (US$8,285 million), an increase of 61% year-over-year.

Revenue from core commerce increased 63% year-over-year to RMB46,462 million (US$6,983 million).

Revenue from cloud computing increased 99% year-over-year to RMB2,975 million (US$447 million).

Mobile MAUs on our China retail marketplaces reached 549 million in September 2017, an increase of 20 million over June 2017.

Net income was RMB17,408 million (US$2,616 million), income from operations was RMB16,584 million (US$2,493 million) and adjusted EBITDA was RMB25,031 million (US$3,762 million). Operating margin was 30%, adjusted EBITDA margin was 45% and adjusted EBITA margin for core commerce was 57%.

Raises revenue guidance to 49-53% growth. 

Shares currently up 2.5% premarket.

https://www.bloomberg.com/news/articles/2017-11-02/alibaba-raises-forecast-after-quarterly-results-top-estimates
"
11,2017-12-14,liano,31,Oracle falls 4% after hours despite earnings beat,"Oracle saw its stock fall by more than 4 percent after reporting better-than-expected earnings for the second quarter of its 2018 fiscal year, which ended on Nov. 30. The company will hold a conference call with analysts at 5 p.m. Eastern time.

EPS: Excluding certain items, 70 cents in earnings per share vs. 68 cents expected by analysts, according to Thomson Reuters.
Revenue: $9.62 billion vs. $9.57 billion expected by analysts, according to Thomson Reuters.
Revenue rose 6 percent year over year, the company said in a statement. On-premises software brings in more revenue than anything else at Oracle, and in this quarter it generated $6.3 billion, which was up 3 percent. But within that category, new software license revenue of $1.35 billion was flat.

Oracle said its cloud revenue grew by 44 percent year over year; analysts had expected a cloud growth rate of 43.7 percent, according to KeyBanc analysts Monika Garg and Jason Celino. Oracle has become more focused on growing its cloud computing revenue amid falling software license revenue.

[article!](https://www.cnbc.com/2017/12/14/oracle-earnings-q2-2018.html)"
12,2017-12-06,gronkspike25,175,"Google pulls YouTube from Amazon devices, escalating spat","A rare public spat in the technology industry escalated on Tuesday when Google said it would block its video streaming application YouTube from two Amazon.com Inc devices and criticized the online retailer for not selling Google hardware.

The feud is the latest in Silicon Valley to put customers in the crossfire of major competitors. Amazon and Google, which is owned by Alphabet Inc, square off in many areas, from cloud computing and online search, to selling voice-controlled gadgets like the Google Home and Amazon Echo Show.

The stakes are high: many in the technology industry expect that interacting with computers by voice will become widespread, and it is unclear if Amazon, Google or another company will dominate the space. Amazon's suite of voice-controlled devices has outsold Google's so far, according to a study by research firm eMarketer from earlier this year.

In a statement, Google said, ""Amazon doesn't carry Google products like Chromecast and Google Home, doesn't make (its) Prime Video available for Google Cast users, and last month stopped selling some of (our sister company) Nest's latest products.

""Given this lack of reciprocity, we are no longer supporting YouTube on Echo Show and Fire TV,"" Google said. ""We hope we can reach an agreement to resolve these issues soon.""

Amazon said in a statement, ""Google is setting a disappointing precedent by selectively blocking customer access to an open website.""

It said it hoped to resolve the issue with Google as soon as possible but customers could access YouTube through the internet - not an app - on the devices in the meantime.

The break has been a long time coming. Amazon kicked the Chromecast, Google's television player, off its retail website in 2015, along with Apple Inc's TV player. Amazon had explained the move by saying it wanted to avoid confusing customers who might expect its Prime Video service to be available on devices sold by Amazon.

Amazon and Apple mended ties earlier this year when it was announced Prime Video would come to Apple TV. Not so with Google.

In September, Google cut off YouTube from the Amazon Echo Show, which had displayed videos on its touchscreen without video recommendations, channel subscriptions and other features. Amazon later reintroduced YouTube to the device, but the voice commands it added violated the use terms and on Tuesday Google again removed the service.

The Fire TV loses access to its YouTube app on Jan. 1, Google said. Amazon has sold that device for longer than the Echo Show, meaning more customers may now be affected.

https://www.google.com/amp/mobile.reuters.com/article/amp/idUSKBN1DZ37O"
