,created_utc,author,score,title,selftext
0,2020-01-15,winterishere314,1,Where to start?,"I want to start investing but have never tried, nor know where to start looking for real advice. Could I get some help with some links and advice to give me a kick start?

I’m not totally stupid, I have a degree in maths, including courses in financial maths, and a PhD but in machine learning. Thanks!"
1,2020-01-06,street-guru,1,AAPL well positioned to outperform in 2020 despite its massive run in 2019,"The FAANGs are increasingly competing against each other, and are likely to start seeing divergent performance after largely moving together the last few years. It will be a battle of the network effects, and AAPL is well positioned to win/outperform because:

1) it has direct  relationships with 900m or 15% of the world's wealthiest consumers;

2)  its successful transition from a product-based company to an ecosystem  company means its relationship with users is becoming increasingly sticky and a product-based company (e.g. Samsung) can no longer  disrupt AAPL; only another ecosystem company (e.g. Google) could  compete;

3) AAPL's increasingly recurring-revenue business model is  driving its valuation multiple expansion;

4) AAPL has the best data for machine learning and AI to drive long-term data network effects,  because its closed ecosystem greatly limits fraud;

5) its enormous net cash position provides the flexibility to invest strategically and  return of capital."
2,2020-02-29,frostbolt4,1,You have a magic crystal ball. You see that in the next few decades A.I and machine learning will erode most of the common jobs. What do you invest in now to ensure you're reaping the benefits of A.I in a jobless world?,"I'm curious what others would invest in now if we were to assume most jobs that are common today are overtaken by artificial intelligence or advance machine learning. My personal belief, and the framing of this question is that reaping the benefit of this future through corporate dividends is the best defence when your jobs is no more. In saying that, what would you be putting your money into?"
3,2020-02-22,winterishere314,1,Does anyone successfully use machine/deep learning?,"Question as the title. Does anyone successfully use machine learning just using local/cloud resources? If so, how many sources do you use?"
4,2020-02-13,Blaize_Pascal,1,Looking for project idea - Machine learning undergrad,"I currently don't have a lot going on at my uni and have therefore decided to search for an interesting hobby project to work on in order to hone my skills.

I'm quite experienced in applied mathematics and computer science and have always been curious about trading. Would anyone happen to have an interesting idea for how I could apply my skillset in investing?

So far I've managed to come up with the following ideas:

\- A model that could estimate the sentiment of a security based on various internet sources (news, twitter, reddit and so forth). I'm however aware that many such models exist, but maybe you guys could suggest a unqiue take on the idea that could be useful to you?

\- A model that could read quarterly reports VERY quickly and figure out whether the reports live up to market expectations. Such a model could perhaps be deployed to trade in the nightly markets such that trades can be made the second the reports are published.

What do you guys think? Any ideas?"
5,2020-02-07,Thehamii,1,NVDA vs AMD,"Hi all,

Currently trying to pick between these 2 and having done my own research wanted to throw it out to this sub to see what I’ve missed.

Coming at this pretty much purely from a cloud gaming view which will dominate gaming in the future.

AMD: Also in the CPU market and are making major in roads here, and will likely grow market share in years to come. Google and Microsoft (leaders in the future of cloud gaming) are both using AMD gpu’s to fuel their platforms. CEO seems to have done a brilliant job since joining and should continue to do so.

NVDA: Also in the AI/machine learning/full self driving space. Tesla make their own chips but if other car companies want to catch up, they go for the next best thing which is NVDA atm. NVDA has their own cloud gaming platform and it is the biggest atm but I think long term google and Microsoft will overtake them comfortably. Not sure what NVDA would then do in this space, especially since cloud gaming may dislodge their GPU sales in consumer devices.

Leaning towards AMD at the moment but would welcome any thoughts."
6,2020-02-01,marketforecast1,1,Experiment: Investing in Future Technologies,"**Experiment: Investing in Future Technologies** 

I like to earn money on investments, and I also love modern technology.

I decided to conduct an experiment: make a list of potential technologies of the future and invest part of my capital in them. There are 14 industries on this list. Keeping track of this number and trying to guess in each one or more potential leaders is quite difficult.

As a result, I decided it was safer to contact not with specific companies, but with ETFs – funds that invest immediately in the industry or some set of companies. As a result, I opened an account with Interactive Brokers and started choosing funds.

&gt;***What kind of ETF and Interactive Brokers, let me just invest in the creation of robocopes***  
*We already wrote about what ETFs are and how they work – if you are in the know, you can skip this paragraph. In short: An ETF is a fund that includes a specific set of securities. When you buy an ETF stock, you invest immediately in all the companies in its portfolio. This is convenient because the threshold for entering the ETF is much lower than if you had to buy shares of each company in this fund. For convenience, you have to pay a commission that covers the costs of the fund.*  
*And Interactive Brokers is an American broker who opens accounts with clients from different countries. Such an account is one of the ways to buy stocks and ETFs on the American stock exchange.*

## How did I choose funds and how much did I invest

I must say right away that in each industry, I eventually allocated one ETF and invested $ 1000 in it. A total of 14 funds and $ 14,000.

When choosing a fund, I was guided by the following criteria:

1. Specialization of the fund on a specific technology, and not on a wide range.
2. Methodology for the selection of issuers.
3. Liquidity.
4. Adequate spread with which you can buy paper.
5. The size of the service fee.
6. Launch date.
7. The presence of competitors.
8. Historical quotes.

In each section, I give illustrations of quotes and geography – from them you can understand the historical profitability of the fund, the effectiveness of the stock selection methodology and how well the fund is diversified: ideally, it should track companies around the world, and not just in the United States.

Many eggs, many baskets. How exchange funds work  
At the end of the article will be an interactive table with all selected funds. It shows what is happening now with my portfolio.

## Fund 1 – Drones

Goldman Sachs predicts that [by 2020, the cost of drones in the world will exceed $ 100 billion](https://www.goldmansachs.com/insights/technology-driving-innovation/drones/). Drones are used everywhere:

1. Military – for reconnaissance and military operations.
2. Consumers are photographers, videographers and just lovers of toys.
3. Law enforcement agencies – for surveillance and patrolling.
4. E-Commerce – Amazon Already Delivers Drones Purchases in the UK
5. Oil and gas sector – for monitoring pipelines.
6. Construction – for maintenance, surveying, mapping.
7. Government agencies for rescue missions.
8. Agriculture – for soil analysis, crop health assessment, pesticide spraying, seed planting and field irrigation throughout the crop cycle.

Now in the drone industry you can invest with only one narrow-profile fund – ETFMG Drone Economy Strategy, [ticker IFLY](https://www.etf.com/IFLY). The fund tracks its own stock index of companies around the world – US companies account for only 58.67% of the portfolio. All index companies are associated with the unmanned aerial vehicle industry, including manufacturers and suppliers. IFLY launched in March 2016, the fund takes a commission of 0.75% for the management.

## Fund 2 – Artificial Intelligence

This sector includes developments in machine learning, neural networks, robotics, face and speech recognition. Thanks to neural networks, the on-board computer of self-driving vehicles can distinguish a pedestrian from other objects on the highway. [Read more](https://marketforecast.online/experiment-investing-in-future-technologies/)"
7,2020-03-16,tttmmmsss,1,Crisis Means a New Business Era | WSJ Op-ed,"&gt;**Crisis Means a New Business Era**

&gt;*Cheap energy, a shift from China and remote work will all shape the long-term economy.*


&gt;The junk-bond-financed $6.75 billion buyout of United Airlines collapsed on Friday, Oct. 13, 1989. The stock market immediately dropped 191 points or almost 7%, equivalent to a 1,500-point drop today. Scary.

&gt;Rod Berens, head of research at Morgan Stanley at the time, called a departmentwide meeting after the market closed. I dreaded going. I had a list of tech stocks I was recommending that got killed that day. When I showed up, I noticed several cases of champagne—a weird way to celebrate the loss of wealth. But why not? I grabbed a glass; it was Friday.

&gt;And then my boss headed toward me. Uh oh, I thought, he’s going to fire me. Instead, he smiled, gave me a high-five and said, “Congratulations, now it’s your turn,” and clinked my glass. Talk about confused—one of the worst days in my professional life and I get congratulated?

&gt;I didn’t see it at the time, but he was dead right. Eras change, sometimes overnight. Over the next decade, the stock market shifted from junk-bond-fueled buyouts, a dominant Japan and the Cold War to highly valued emerging technology companies, ending with the dot-com blowout.

&gt;The current market turmoil tells me a new era is breaking, so question everything. Will cable, energy, mobile and social media ever come back? And if not, what’s next?

&gt;Well, the knee-jerk reactions will come first. Most think the 2003 SARS epidemic in China ushered in that country’s era of e-commerce, but it was going to happen anyway—the crisis only accelerated it. So be wary about talk of robot and drone deliveries. It may come to that if the virus spreads, but the economics still seem far out.

&gt;Will energy stay cheap forever after this week’s devastation? I doubt it, but the economy can finally benefit from fracking’s cheap natural gas. I’d bet so-called clean and renewable energy was set back a decade by having to compete with lower prices. Cheap fossil fuels may also push back any new adoption of carbon-free nuclear energy.

&gt;More interesting is the emptying of countless college campuses, sending students home. Classes will be online-only until further notice. Smart. But at some point parents will surely ask, “Why again are we paying 78 grand a year?” Is the end of universities far behind?

&gt;Similarly, lots of companies are telling employees to work at home. Will an era of telecommuting and no rush-hour traffic finally arrive? Maybe not. Recall that early in Marissa Mayer’s tenure as Yahoo CEO, she banned working from home because so many people were, as they say, mailing it in.

&gt;The end of China’s dominance is certainly coming. No one will ever again concentrate manufacturing in China alone. Vietnam and other countries with low-cost labor will benefit. Maybe this is Africa’s moment. Related: A louder globalization backlash may arise again—but since consumers like cheap goods, it will flame out.

&gt;Another observation: Interest rates and the Federal Reserve may be increasingly irrelevant. The Fed’s job seems to be to ensure the availability of Treasurys—mostly, as we wrote last September, as collateral for the repo market, which finances an increasing share of global trade. The $500 billion announced Thursday is encouraging.

&gt;What about mobile and cloud computing, and even the stock market and its trillion-dollar valuations? It’s worth asking, as venture capital and private equity using cheap debt are keeping companies private longer, or forever. Others think it is value stocks’ turn to shine, but that usually requires a period of inflation that I certainly don’t see coming. Quite the opposite.

&gt;No, growth will still rule, but with a different set of leaders. In the bio world, DNA sequencing and Crispr gene editing are starting to ramp up. Health care will be transformed by new ways to detect and treat cancer and other ways to cure previously incurable diseases like sickle-cell anemia.

&gt;In the high-tech world, mobile seems tired. Apple’s hottest product is AirPods Pro, those Star Wars-inspired white sticks hanging out of everyone’s ears. That’s an accessory, not an innovation. Here’s hoping for some knock-your-socks-off new mobile products. Note also that we’re only about a third of the way into the cloudification of enterprises. And we’re only beginning to master machine learning and artificial intelligence, with their ability to find patterns that humans can’t. I think the next tech era will be driven by implementation of AI-infused systems into every business.

&gt;Finally, I asked the man himself, Rod Berens, whom he’d high-five today. He says that the past 30 year’s tech abundance means the developing world’s billions will finally see productivity improvements and attract an increasing share of investment. That’s probably right.

&gt;New eras are notoriously hard to predict. So instead of focusing on which cities are quarantined, start thinking about what’s next. Very few investors do."
8,2020-03-06,street-guru,1,$AMD Highlights from Investor Day in Santa Clara,"Analyst day was largely as expected. It was encouraging to hear management reconfirm Q1 guidance, although sales may come in at the low end due to the coronavirus (not a surprise at this point). Most assume sales will pick back up in the 2H, so full year street estimates are unlikely to changing much from this event.

AMD's pivot in GPU strategy from general-purpose GPUs to domain-specific GPUs seems like a smart move in adapting to the market evolution. The Radeon DNA will be optimized for gaming, while Compute DNA will be optimized for machine learning etc.

AMD's market share gain story has been rewarding for shareholders, but the biggest push-back now is its valuation (\~33x forward PE vs. \~19x for peer group), leaving some to wonder if all the good news has been priced in. AMD will likely get a top-line boost in 2H from gaming console refresh, but this is a low margin business.

As the ""second horse"" in the declining PC market, AMD still needs to prove it has a long-term profitable business model. $INTC and $NVDA appear to be in better financial position to strengthen their positions in both CPU and GPU markets. AMD chasing the low-margin gaming business could hinder its ability to improve profitability."
9,2020-03-01,Reddit_Rabbit_Cat,1,"Machine learning beats BTC/USDT on unseen data, even with transaction fees and slippage.","[https://medium.com/@m1balcerak/machine-learning-beats-btc-usdt-on-unseen-data-even-with-transaction-fees-and-slippage-caa5e7a40caf?source=friends\_link&amp;sk=8feb7976e93ae96f024e289d5294c4ea](https://medium.com/@m1balcerak/machine-learning-beats-btc-usdt-on-unseen-data-even-with-transaction-fees-and-slippage-caa5e7a40caf?source=friends_link&amp;sk=8feb7976e93ae96f024e289d5294c4ea)

I have just published an article on medium about my ML research and a \~1.5y fight with the markets. I tried to be as informative as possible. Let me know what you think!

Interested in bitcoin data ? Here is a link to my kaggle with a juicy dataset and 2019 summary:

[https://www.kaggle.com/michalbalcerak/1min-btcusdt-hitbtc-data-with-volumes-and-summary](https://www.kaggle.com/michalbalcerak/1min-btcusdt-hitbtc-data-with-volumes-and-summary)

If you like the article and found it informative, please consider upvoting my startup (which provided the data) on producthunt:

[https://www.producthunt.com/posts/acai](https://www.producthunt.com/posts/acai)

I would really appreciate it!"
10,2020-04-25,rawrtherapy,1,How Power BI (Microsoft’s Self-Service Data Visualization Platform) will be their new Halo Platform that will lead Data Science,"**TL;DR: Power BI can add pre-made Machine and deep learning models. Recent press conference this was specifically mentioned for scale. I think Microsoft is planning a Machine Learning Store for commercial purposes working like the App Store for pre-made models.**

Also I work in the Data Science Field.

——————————————————————

As some of you may or may not know, Power BI has the ability to add pre-made machine learning and deep learning models internally

Once I learned about this I knew where Microsoft was headed

I’m thinking machine learning and AI will be a sort of addition to power bi users completely nulling the need for learning code, why?

Microsoft’s job is to make it as easy as possible for everyone to use their systems and this is why I think Microsoft will have a similar variation of the “App Store” for machine learning models and algorithms

Actual engineers will have the unique experience to be sort of like an app developer where they develop their code and publish it in the App Store and people using Power BI will be able to either download it for free or for a small fee

In their recent press conference about Power BI they mentioned pre-made models being directly implemented into the power BI software and said that this was done specifically for scale

In my opinion, I really think this is the direction Microsoft is headed with their Power BI software and their implementation of scale through Machine Learning for everybody

Long MSFT for the next ten years bigly"
11,2020-04-24,quary1993,1,Predicting Bitcoin Price with Machine Learning and K-Clustering Unsupervised Learning,"I'm trying for some time now to develop a neural network that can predict bitcoin prices. Bitcoin is a great asset for such an experiment because it has fewer fundamentals than the other stocks or derivatives and it relies more on technical analysis than other assets. Nevertheless, it is impacted from time to time by the news and other events in the crypto-world.

&amp;#x200B;

I am working with TF (tensorflow) + Keras and LSTM (Long-Short Term Memory) cells to try and predict future prices.

&amp;#x200B;

If I let the network guess freely, from some point onwards, without feeding the price of the tick before, the predictions look like this: [https://i.imgur.com/Qk50hdv.png](https://i.imgur.com/Qk50hdv.png) and this [https://i.imgur.com/OCRep8r.png](https://i.imgur.com/OCRep8r.png)

&amp;#x200B;

If i adjust it at every point in the dataset (feed the price of the tick before), it is needless to say that the graph of predictions is way more precise: [https://i.imgur.com/Y1H3n9z.png](https://i.imgur.com/Y1H3n9z.png)

&amp;#x200B;

There are few steps I would like to take to improve this

* Factor in Technical indicator (BB, Ichimoku Cloud, SAR, etc...
* Place a factor for fundamental analysis in the dataset (for example, a score for the positivity of the news at that specific tick (0=bad news for btc, 10=great news)\[/li\]
* Collect data from the order books of the largest exchanged and factor in the order book states at every tick
* Unsupervised learning and K-Clustering to find co-relations between bitcoin and other foreign currency (for example, it might be that there's an inverse relationship between bitcoin and the Yuan (generally when Yuan drops, Bitcoin rises). K-Clustering can find such relationships
* Merging all of the above into a trading bot that aims for around 30%-40% return a year

&amp;#x200B;

Does anyone pursue such a goal? If yes, would you like to share the accumulated knowledge/ideas? :D

This is a serious project and currently, only me and two of my partners are involved in it, but we could sure use some more man-power. I'd also like to know if someone would like to fund such a venture and get involved.

&amp;#x200B;

Cheers to you all!"
12,2020-04-22,UnknownEssence,1,Which companies are leading in the AI/Machine Learning field?,"I don't mean narrow use cases such as Tesla with self driving, but rather general AI which can apply to a wide variety of use cases. 

I believe machine learning algorithms will transform our world more than the internet has in the past 20 years, with the application of these algorithms stretching wide and far in almost every field of work from medical, legal, you name it. The rise of general artificial intelligence will transform every aspect of our lives. Aside from Google's Deep Mind, How can I best get a piece of the pie?"
