,created_utc,author,score,title,selftext
13,2020-04-20,pilipinonguci11,1,My thoughts on the stock," 

There is no TL;DR

If you don't have the attention span to read this, feel free to go back to working minimum wage at McDonald's while living in your mom's basement and bitch about the world while browsing [r/mgtow](https://www.reddit.com/r/mgtow/)and [r/nofap](https://www.reddit.com/r/nofap/) thinking it's actually helping you. No judgement. We've all been there.

At a certain point, though, your balls are going to drop and you're gonna grow the fuck up.

**Intro**

The way that the administration is currently handling the 2020 Coronavirus Pandemic is proof that they have learned nothing from the government’s pitiful response in 2008

In this overview, I am going to be covering how the U.S. administration has addressed the coronavirus from an economic incentives standpoint. I will also be analyzing its response on how it’ll go about “flattening the curve” as stated in common parlance.

**Overview on the SBA and PPP programs (and how they’re going to COMPLETELY screw over the economy a la mortage loans in 2008)**  
As a response to the coronavirus, the government has decided to allow the Small Business Association (SBA) to give out loans to small businesses as a form of “disaster relief”. According to Reddit, banks are actually RUSHING out these loans to businesses that were overleveraged (i.e. had a significant amount of debt) before the coronavirus crisis occurred. What does this mean?

Once again, the U.S. government has decided that certain businesses are simply TOO BIG TO FAIL (Henceforth referred to as TBTF). That means that you can bet your bottom dollar that the U.S. government will do everything in its power to bail these companies out of bankruptcy to the best of its ability. This creates a significant MORAL HAZARD. These TBTF businesses now know that they will continue to be bailed out by Uncle Sam if (or, more likely than not, when) they fail and are on the verge of bankruptcy. So much for the notion of free-market capitalism :shrug:

Furthermore, banks just simply do NOT have the capacity to handle the sheer amount of SBA loans that business owners have applied for. By the time all of these applications are completely processed, it isn’t out of the question that a significant majority of these small businesses will go completely bankrupt. The fact of the matter is that many small businesses and business owners live paycheck to paycheck. In general, business owners are NOT your “1%’er greedy scumbag that just cares about profits and loves screwing his workers and pulling the wool of shareholder’s eyes” that Bernie Sanders and his motley crew would have you believe. Small business owners are similar to you and I, they’re just trying to get by financially. When these SBA loans don’t get processed on time, guess what? A lot of these small business owners simply will NOT have enough cash on hand to pay their liabilities (e.g. leases, worker’s salaries, etc.) and will be FORCED to shrink their business to stay afloat (leading to significantly decreased revenue, which investors do NOT want to see) or will be forced to go bankrupt.

**Trump’s pitiful and very, very sad stimulus checks**

Another economic response that the government has provided is the $1,200 stimulus check. Let’s see how this stimulus check will be handed out and who will receive this stimulus check.  
Single adults with $75,000 or less on their 2019 tax returns will receive a $1,200 check. Married couples will receive $2,400 jointly and an additional $500 for children under 17.  
The idea behind these stimulus checks is that it will jumpstart the economy back up by giving consumers money to be able to go out and purchase goods. However, does anybody realistically think that the $1,200 check is enough to sustain these families? Assuming the quarantine lasts longer than the middle of May (a significant possibility), a paltry $1,200 check will barely be enough for people to get by. Rent costs $1,200 or more in some cases for just one month. This stimulus check is in essence a virtue signal from the U.S. government to retail investors that they will intervene in the markets. However, the stimulus checks won’t actually do anything. That $1,200 will go by faster than the roadrunner escaping Wile E. Coyote.

Small businesses will continue to die off in droves, and enterprise companies will accumulate market-share and power as they begin to buyout companies or let their competitors go bankrupt.

**Faulty Unemployment Numbers**

[https://www.nbcnews.com/news/us-news/out-work-because-coronavirus-struggling-file-unemployment-n1175466](https://www.nbcnews.com/news/us-news/out-work-because-coronavirus-struggling-file-unemployment-n1175466)

Based on the news, as well as personal anecdotes from friends, it is VERY, VERY difficult to file for unemployment now. The offices are all backed up with people trying to file unemployment claims and there's a huge backlog that they need to take care of.

That means the number of unemployed people will be SIGNIFICANTLY higher than the numbers that the BLS will be putting out. Those unemployed people will be unable to go out and purchase goods due to a lack of cash, which will negatively impact company's earnings across the board.

**Actual Coronavirus and its Impact**

""The curve is flattening!!""

Yeah, the curve is flattening because we have a limited number of tests available. The number of coronavirus positive cases can't go up if you don't test them \*insert Roll Safe tapping on head meme here\*. There's a fuckton more people who are coronavirus-positive that we don't know about simply because we haven't tested them yet.

We still don't have a vaccine. Do you really think this shit is over with? Once we reopen, there's going to be a second wave of infections. That'll cause there to be panic again, which will possibly cause another lockdown/quarantine. At which point, we'll keep cycling being lockdown and reopening the eocnomy ad nauseaum until a vaccine is discovered. We will see the long-term effects of the coronavirus on company's earnings which will be reflected in quarter one and quarter two earnings. That means we have a MUCH longer way down to go from here for SPY.

**Impact of coronavirus and quarantine on mental health**

[https://www.buzzfeednews.com/article/tasneemnashrulla/text-messages-crisis-hotline-coronavirus-mental-health](https://www.buzzfeednews.com/article/tasneemnashrulla/text-messages-crisis-hotline-coronavirus-mental-health)

The coronavirus and quarantine is also completely devastating to people's mental health. This is a novel situation that people haven't faced before. People are more scared, anxious, and worried than ever before. This will also reflect in consumer purchasing decisions in the long-term. Consumer purchasing will be dampened until a vaccine is discovered

**Conclusion**

Now is the greatest time to buy puts on SPY with an expiration date of 6 months out or more. Don't buy puts with sooner expiration dates because Trump might find some way to manipulate the market in short-term. The fundamentals are clear: the coronavirus is here to stay. Earnings will be down for quarter one and stay down to quarter two and beyond.

With that being said, if the market is still up in the long-term and a vaccine hasn't been discovered, I can only conclude that either

1. The U.S. dollar has become completely worthless
2. The stock market is completely disconnected from the economy in every way, shape, and form and stonks only go up. Trump found the secret formula to make his 1% friends rich. Dump all your money in the stock market and hold hands with the Vice Presidents of Bank of American, Chase, and JP Morgan as we sing Kumbaya and eventually ascend into capitalist heaven while Kanye West's ""Selah"" is playing in the background. Adam Smith, the creator of capitalism, greets you with a smile. ""All money is a matter of belief"", he says. ""Individual ambition serves the common good"". You close your eyes. Earth is decimated. Life has ceased to exist on earth. The only action left are several computers running machine learning trading algorithms 24/7 trading against each other. The S&amp;P 500 has reached an all-time high of 5,000. One computer whirrs slightly louder than usual as it rewards itself for having 420% returns year over year. The heat death of the universe occurs several billions of years later. The trading algorithms are still running in the background, trading against each other. The heat death of the universe has been priced in. The S&amp;P 500 reaches 10,000

**Some thoughts on certain individual stocks**

**Zoom (ZM)**

Zoom, as you probably know if you are working remotely, is a remote teleconference tool that many companies are using. I believe that Zoom is VASTLY overvalued and that its current market valuation is based off of irrational investor sentiment as opposed to fundamentals of the market.  
The market is currently valuing zoom at a WHOPPING 42 billion dollars!!! Holy cow!!! When Microsoft acquired Skype in 2011, it acquired Skype for $8.5 billion in cash. That’s about $10 billion in today’s money. Is it realistic to think that Zoom is worth 4X more than Skype currently? Absolutely not!!!

Let’s look at the bull case for Zoom. Yes, a lot of people are using Zoom than ever before. However, these people are not paying for Zoom. Zoom went from $75 to $150 in a span of a month because… more people were using it. That’s about it. They’re not paying customers. Unless the quarantine lasts a long time, these companies will not continue to use Zoom and even if they continue to use Zoom they won’t be paying for the software.

Bearish case: Zoom’s P/E ratio is 1,700X. Holy moly, batman!!! Amazon, widely considered to be a significant growth stock, has a P/E ratio of 100X. Apparently Zoom’s multiplier is 17X larger than Amazon’s because…. Nothing. Seriously, can anybody explain how Zoom has such a larger P/E multiplier than Amazon? No, they can’t.

Number of privacy/security concerns with Zoom. Zoom says that they are trying to fix these issues but it is debatable how long it will take to get these fixed."
14,2020-04-18,mightyXi,1,Dow Jones very similar to chart from great depression,"I looked at the two charts today and it's almost eerie how similar they look. Back then was about 50 percent slower (ie what happened back then in 3 months now happened in 2). Applying that logic and using similar proportions we would have our bottom around August next year at around 8000 points. Of course this is all BS and nonsense, but there's one thing I can't get out of my head:

What's the chance all the machine learning driven trading algos are completely overfitted to that historical data point due to lack of other similar events? If so this would have been gone unnoticed so far (neural nets are mostly a black box assuming they use some of those) and it would even be a self fulfilling prophecy. Based on the model the algorithm would assume a certain target price and trade accordingly eventually leading to that exact price of enough players follow the same logic.

Well it's probably still all BS, but I'll keep watching whether it stays that similar. Hope I could at least entertain you a bit."
15,2020-04-07,mlgains,0,"Stop making machine learning in finance seem like such an easy, doable thing.","They seem to think that machine learning interpretability is at level that everyone can start using these tools but I don't know if I believe that they are that accessible, seems pretty black boxy to me. What do you think?  
Has anyone here had success using machine learning to predict the direction of stocks or the like? Was it hard for you to do? How did you go about doing it? 

[https://www.enjine.com/blog/why-now-is-the-time-for-machine-learning-in-finance/](https://www.enjine.com/blog/why-now-is-the-time-for-machine-learning-in-finance/)"
