,created_utc,author,score,title,selftext
0,2018-02-08,LZCam,10,Tobii (Sweden) - What am I missing?,"Hi! I read this forum a lot for advice and guidance, but haven't felt the need to post until now.

I invest in foreign shares, not just US, and I've been tracking a company in Sweden called Tobii. The price seems down, and I'm not sure what I'm missing:

- The market leaders in eye tracking technology
- 2 solid, profitable business units that arguably support the current valuation on their own
- A growth, consumer electronics, focused business unit.
- Eye tracking technology is widely regarded as a must have for VR and AR devices.
- Their 3 main competitors have been acquired by Apple, Google, and Facebook in the last 2 years.
- They have announced they are actively working with 5 major customers for launch in 2018/2019, and in dialogue with a potential 10 more.

To me it seems like a perfect storm for a tech breakthrough, but the price continues to gradually go lower, and lower. The best I can tell is the market is weary of waiting for actual announcements of partnerships (they do have laptops out with Alienware, Acer and MSI though).

I can't help but feel that if this company was based in Silicon Valley, and listed on the main NASDAQ, it would be much more hyped.

I'm not a technical analyst, I invest based on my overall view of a company's prospects, and probably I look at it a little too simplistically. So if anyone has any thoughts, I would love to hear them."
1,2018-02-06,sirloinfurr,10,Walmart has acquired a virtual reality startup as part of its tech makeover,https://www.recode.net/2018/2/6/16977006/walmart-vr-virtual-reality-spatialand-store-no-8
2,2018-03-03,JumpinJulius,0,Thoughts on nvidia (graphics card company) now that VR headsets are on the rise,"So I just got a vr headset and it is astounding. Everyone who has tried it has loved it and wanted one. This got me thinking. Which vr company would be the best to invest in. But if any of them are successful nvidia will do well. Of course it is too expensive for most people to want to buy one right now but computer prices always drop. I think nvidia even provides the graphics cards for play stations. In addition, I know lots of people buying cards for mining which doesn't hurt. "
3,2018-04-12,sasksean,46,On Micron and why the memory market is not cyclical anymore.,"Every GPU sold requires huge quantities of expensive RAM and availability of that RAM is what determines how many chips Nvidia or AMD can sell. Somehow Nvidia warrants a P/E ratio of 50 but Micron only a 5 even though Nvidia is the one holding it's bowl out at the doorstep of the memory fabs.

Memory is baked into so many products now that the market demand is nearly in crisis. Tensor cores, video surveillance, portable VR, autonomous machines, crypto-currency... memory is a commodity that is suddenly found to be so much more ubiquitous than it used to be. Historic trends of even two years ago have no relevance anymore.

There is also an AI cold war brewing and Micron is the only large US based manufacturer of memory. The US government will not allow it to fail. China can't afford to tariff Micron either because they have no domestic fabs and want all the AI resources they can buy. They are desperate to get their own production online but that will take years and the AI supremacy war will be in full swing by then. China will consume all the resources it can manufacture and would be reluctant to allow it's foundries to fuel foreign AI regardless.

There will be an explosion of demand in the next five years and the projected supply increase will not be able to keep up.

The current value of Micron has an assumption that the price of RAM will crash already baked in. If it doesn't crash, the current valuation of the company is low by a magnitude. It's absurd. I'm growing suspicious of anyone bearish on Micron as being part of a propaganda machine."
4,2018-04-10,ban_human_traffickin,0,Just bought 2000 shares of Facebook (FB) @ $161. Here's why,"For the past 5 years, Facebook has shown steady growth and growing earnings, and the stock has gone nowhere but up. The latest FUD (fear uncertainty doubt) propagated by the media will be short lived, just like the FUD with EA a while back. 

More importantly, Facebook is more than just Facebook. Facebook owns WhatsApp, Instagram, and more. They are also pioneering VR and AI technologies. Facebook is the king of advertisement. Facebook is here to stay. 

I think Facebook will at least touch the $190s again after they release earnings this month. I recommend buying now. I myself just bought 2000 shares at $161. There's no reason not to.

EDIT: Holy cow there's too much hate in this thread. For the doubters, here's proof: https://imgur.com/a/eQUl8"
5,2018-06-25,Warpeous,0,Apple is no longer paving the future in tech,"Smart speakers caught Apple flat footed. The HomePod was a flop, with numerous reports revealing Apple cut back orders after weak demand. My biggest problem with HomePod was that it only supported Apple Music, not Spotify. This made no sense if Apple wanted to dominate the market. HomePod could’ve been another platform for app makers, like iPhone, Mac, and even iMessage which has its own App Store and developers.

Wearables are not the future of tech. Apple may be the largest watch maker, but watches are a tiny market, and that’s like being a humpback whale in a koi pond. 

Apple has dipped its pinky toe in augmented and virtual reality, having an app section for augmented reality and creating a few applications like a virtual measuring tape and a virtual ping-pong game, but they haven’t created their own headset to compete with Oculus or HoloLens. Now virtual reality is nowhere near where it needs to be to catch on as the technology still isn’t there and the price tag is too high, but even then, anyone who has put on a virtual reality headset will tell you how impressive the experience truly is. And yet Apple is moot on VR.

Apple’s investment in original content is a joke, buying Carpool Karaoke and hiring Oprah. Just like smartspeakers, Apple’s original content seems to be a lackluster response to what other tech industry giants like Amazon and Google are doing with their own original content. Amazon Studios is making well received content being shown in movie theaters, like The Big Sick, and Google’s YouTube is getting into original content with the well-received show Cobra Kai.

Most important of all is the fact Apple continues to drop the ball on apps that are data intensive in order to function properly. Siri require lots of data to be able to answer questions, which is why Siri sucks. Apple Maps requires lots of data to construct maps, which is why Apple Maps sucks. So Apple may be angling to take the higher ground by saying it doesn’t use your data, and that’s fine, but when data-intensive apps start to suffer, it may be time for Apple to take a new approach.

The butterfly keyboards on MacBooks have been universally faulty, to the point Apple has started a free repair program. The removal of the headphone jack is still being questioned 2 years later. The tablet market as a whole is shrinking. Android phones are just as good if not better than iPhones. 

Now Warren Buffett may have doubled down on buying Apple stock, and from an accounting view that’s an obvious choice. Apple is by far the most profitable company right now. But that doesn’t make it the future of tech. And when Apple picks fights with companies like Facebook, it’s probably why there’s no Instagram app for iPad. 

I’ve been watching Apple’s market cap for the past 6 months, and right now it’s the lowest it’s ever been, hovering around $906 B, when it’s usually around $936 B. Amazon is catching up at around $825 B, Google is trailing at $806 B, while Microsoft is lagging at around $760 B. Personally I find following market caps more fun that serious, but the fact Apple has flirted with the trillion dollar market cap but hasn’t passed it for this long while other tech companies keep closing the gap, it’s starting to look like Apple is no longer the groundbreaking tech company of the future."
6,2018-06-24,luchins,2,Which will be in the next bubble in a decade/20years from now?,"What  do you think  will be  the next bubble?

I forecast a  period  of  recession  of  5  years  in the tech stocks  field. Than a  new bubble   will  commence   with   new  twcnologies like:

Augmented reality, DNA  engeneering, self-drive cars, Virtual reality, Smart contracts  and  automatation of  banks  jobs (Chainlink),  AI  powered  smart contracts  used into robotics, I.O.T.  sistems  which  will bring personalized  ads to you trought  your  fridge (data  mining from you and  from your house) ,artificial meat  new materials integrations  into neuromorphing chips...  decentralization of  cloud computing....    Well  among  all  this  great  future idea-s   which  stocks  would  you pick up  for each  field  I have  described (VR, AR, IOT, smart contracts, DNA  engeneering)?

Serious  discussion please... the bubble  bring a lot  of money  "
7,2018-06-14,mbmike12,1,Opinion Change - VR potential,"I got the chance to mess around with VR today and holy crap.  It changed my mind on the product.  Museums, educational purposes, simulating complex processes - it all gets presented in the optimal way through VR.  

If you like me and pretty much can't enjoy museums because of all the etiquette, standing, and red tape, your mind will change if you can sit down and sip a beer while you move around the Louvre looking at the most famous paintings in the world.

I think it might not happen anytime soon, but the companies that are making headway in VR will be able to make some serious profits when entire classrooms learn about relativity and planetary formation with VR headsets on with the teacher showing them how stars explode right before their eyes.

The jump-scare and rollercoaster stuff isn't for me, but diving into paintings, black holes, and space was pretty insane.

My mind has changed on VR.  Long FB and anybody else involved in it."
8,2018-06-03,Borne2Run,2,What are the indicators you seek that would warrant investment in Virtual Reality?,"Looking to generate some discussion. The industry has some potential to expand, I think. With gaming concepts like [Beat Saber](https://youtu.be/gV1sw4lfwFw) and some tie-ins on the PS4, it'd be cool if there were arcades that catered to this technology. 

Where do you think VR will be in 5 years, or 10 years? What indicators would you look for to determine the right company to invest in?"
9,2018-07-29,_Thrillhouse_,6,Virtual Reality Companies,"I have a bit of a weird question and I apologize if this is the incorrect subreddit for this.  


For you to understand the question I have to give you a very quick backstory and explain my situation.

Almost 2 years ago, I got a new job that I very much enjoy and have started making a bit more money than I recently did. 

I've been trying for once in my life to get smart about finances so I made out a plan, started budgeting, read multiple books, and even got a financial planner.  To skim over everything, for the first time in my life I'm feeling like I might actually be safe and stable for a while. I'm very frugal in most ways, I pay off my credit card debt, mortgage and car payments have never been missed and I have a good credit score.

But for the first time with a bit of disposable income, I wanted to do two things: get healthy and set aside a fund of money for ""riskier"" investments, as a sort of hobby. I have done minor stuff here and there, generally been mostly basically broke even, maybe an occasional profit but nothing serious. But I'm always watching stuff and reading about them almost out of curiosity. Like a little game or challenge to see if your assessment and predictions become true or not.

So to get healthy I bought a HTC Vive. I heard you move around a bunch, I enjoy gaming, and I loved Sci-Fi movies and books and always thought the idea of VR was cool but it's been disappointing every time I've tried it. So again to skim over, I'm fully on board with this technology. It's fucking insane how much you move. There are some games that I literally can't play for more then 20-30 minutes. I added wrist weights to add to it and I mean it feels like a full on, better than usual workouts at a gym. Both cardio and muscle. It's finally here. It's not the end version, it's a couple off, but it's a couple years, not decades. I keep equating it to my brother this way:

Remember when we got a Nintendo 64 for Christmas when we were kids and it was like one the greatest thing ever at the time? We couldn't BELIEVE the graphics and gameplay of Mario 64. You look at that now, compared to graphics we see today, and it's laughable how simple they are. I feel like the Vive and Rift are the N64 version of VR so within 5-10 years, people are going to go HOLY SHIT, virtual reality is incredible. And it's not just gaming. They have educational experiences. You can do simulators to get over phobias. There are social functions like communities where hang out and chat. I played ping pong with a dude from Bangladash for like 30 minutes the other day, just bullshitting.   


So. To my question.

I am in no way wealthy, but I feel  secure enough that I'm trying to figure out if there's anyway to actually put in some money  into a technology that I believe is going to be literally one of those rare ""game changer"" technologies. I just can't fucking figure out how to do it. I mean would it be just investing into some stocks of companies like HTC? How can someone, completely on the outside, try to simply financially back a concept like VR but not a specific company per se? I'm just trying to figure out the most reasonable, rational, way that an every day Joe with a fair amount of research but for sure not an MBA or anything can try to take a chance?  


Any suggestions would be greatly greatly appreciated. Honestly even something like ""take out a loan and hire people to start making VR games or open a VR gymnasium"".  


And I also do understand that there are LOADS of news articles talking about how unsuccessful VR is or how the companies are this or that. I understand those may be true now, I'm just saying I am buying on the fact that I trust my judgement of the technology as a concept and the future of it, not a SPECIFIC company"
10,2018-07-20,Hungry10,0,VR &amp; AR stocks to invest,"I'm confident VR and AR are going to be the new smartphone of next decade. Just need help in which stocks to invest in, done a bunch of research but its so hard to choose which one to fully invest in. Big companies stock prices are just too much so rather want stocks that are the underground

Thanks"
11,2018-07-16,MarcImBack,4,Vuzix ($VUZI) - Pure AR Play,"Smart phones already augment our reality, however, the interface is on our phone. When using gps you need to look at your phone sometimes if you’re in an unfamiliar area. 

I never used Google Glass, but from I can tell, Vuzix is producing something that looks consumer friendly. 

Go on YouTube and there is plenty of reaction videos where people freak out. 

The Blade uses wavefront technology, which is the same eye tracking technology used for LASIK eye surgery, so it knows where you are looking and can adjust accordingly. Furthermore, this tech can be used for eye gestures down the road. 

Developer kits are being produced and will ship this year. Smart people will get their hands on them and start building apps/programs for the glasses. 

Why do I think this a good long buy? 

Oculus Rift, a solid VR producer, was bought out by Facebook. 

Vuzix offers a turn key solution for a large company interested in the AR space. 

Cheers"
12,2018-07-06,unknown_poo,4,"Demand for Augmented Reality/Virtual Reality Headsets Expected to Rebound in 2018, Says IDC","[Link](https://www.idc.com/getdoc.jsp?containerId=prUS43639318)


What are your thoughts on the VR industry? Where do you think the best areas to invest in are? I am thinking that the video card industry will see another arms race boom, similar to what we saw with respect to bitcoin. Probably not as intense and sharp, but seeing as how GPUs are one of the primary limiting factors to producing high quality VR, I suspect that there will be a race to develop this technology further and also the quickest. "
13,2018-08-23,wirsteve,390,What's reddit's opinion of the next big thing in tech?,"Pretty obvious what it is now, ""Cloud Computing"". Companies have to ""move to the cloud"". Some companies don't even have directors of IT on staff, they just hire a consulting firm to move them to the ""cloud"" but they don't know what it is.

Let's say 5 years ago

* Everything was hosted locally or with an IT provider. Citrix for example was popular
* The number of apps in iOS app store and Play store have tripled - mobile is king
* Businesses slowly started to look at technology as a need and not as a luxury

Now 

* SaaS is king, hosting data in Azure, AWS or Google's data centers is popular
* Citrix is still used but in a different capacity
* You need a mobile app to pair with your website / company to be looked at seriously
* eCommerce has been changed dramatically with Square &amp; competitors

So what's next?

* Edge networking?
* A boom in security spending?
* Machine learning?
* Blockchain?
* VR &amp; AR?
* Internet of Things?
* Smart kitchens?
* 3D Printing?

We all know deep down, whatever the infrastructure is now, and whatever is popular now won't be in 2023. I'd love to hear what you guys think. Obviously my list isn't what you have to pick from. It's just some things that I think could potentially take off."
14,2018-08-18,Revolver123,1,What is going on with Facebook?,"Their earnings call wasn’t great, which caused its share price to plummet overnight. Everyone said it is a perfect time to get in since Facebook makes so much profits and has a great balance sheet. 

The stock rebounded over the next week to 185. And then it fell again to 173. 

What gives here? Facebook has a monopoly on social media, plus ventures into vr gaming. Why are people not bullish on this one? "
15,2018-08-15,blubba_84,6,Investing in VR/AR industri,"I have strong believes in the VR/AR market is going to be huge in the future. Does anyone have any tips of how to invest in the industry, stocks, funds etc.?
I know of one fund called  tactile analytics vr/AR etf anyone know of this? "
16,2018-08-13,sasksean,31,Nvidia earnings.,"The digicoin market has collapsed. Used high end cards are all over classifieds.

VR still has no killer apps that would create demand for high end cards.

Most people still game on 1080p@60 fps which a budget GTX1060 satisfies now.

Making a game look a magnitude better requires much larger textures. This means DRAM is a major bottleneck going forward.

Nvidia's only solid market ATM is AI and their biggest customers are all developing their own proprietary solutions.

I expect a bump in earnings for sales of GPUs to partners this quarter but weak sales of those partner's cards so a slump in earning from Nvidia in subsequent quarters.

I'm not confident in Nvidia for 2020+ but calls for the next quarter or two are likely good."
17,2018-08-04,chucomsen,0,What are your quick and long term investments? Video games? Crypto? Virtual Reality?,Just curious what you guys think about the latter part of this year and moving forward. I see VR making a leap (longer term). I noticed AMD is low price still. HTC.. CD Projekt Red.. Thoughts?
18,2018-08-03,etfrisk,1,Virtual Reality ETF (AUGR),"This is quite exciting, for folks that embrace early technology in their portfolios and believe in the movement around VR, there's a new ETF on the block that promises great exposure to this space.

The Defiance Future Tech ETF (AUGR) is a newly launched ETF. Their intent is to offer a passive way to get exposure to disruptive technologies.  According to its prospectus the ETF will invest in companies that are focused on the development and commercialization of augmented and virtual reality technologies, including artificial intelligence, gaming systems etc as well as companies producing components utilized with these technologies like sensors, the backend software and display equipment.

Interestingly this portfolio will hold companies from around the world that are working in this space.  

The top 10 holdings are:

Nintendo  Co 2.72%
Silicon Motion Technology 2.19%
Faro Technologies  2.14%
Dassault Systems 2.06%
Walt Disney Co. 1.96%
Sony Corp. 1.73%
Ubisoft Entertainment 1.65%
Immersion Corp. 1.50%
Snap Inc. 1.47%
Kopin Corp. 1.30%

___________________
etfrisk.ca
"
