,created_utc,author,score,title,selftext
0,2019-01-31,pauldecker,1,"Prime Talent Chain, Making the Much-Needed Transformation for the Recruitment Industry with Skill Communities"," Prime Talent Chain (PTC) with the concept of Skill Communities aspires to revolutionize the recruitment industry. Backed by advanced technologies like Blockchain, Artificial Intelligence, Machine learning, and Big Data, [Prime Talent Chain](https://c212.net/c/link/?t=0&amp;l=en&amp;o=2357298-1&amp;h=2361234571&amp;u=https%3A%2F%2Fprimetalentchain.com%2F&amp;a=Prime+Talent+Chain) has carved out tools that are exceptional. The company seeks funds to develop a sophisticated PTC app for every recruiter and job seekers' benefits and wants you to partake in the same.

**Social Media**  
**Telegram:** [https://t.me/joinchat/Ij6yrkU2EnWDDQ1GgL83YA](https://c212.net/c/link/?t=0&amp;l=en&amp;o=2357298-1&amp;h=2310848778&amp;u=https%3A%2F%2Ft.me%2Fjoinchat%2FIj6yrkU2EnWDDQ1GgL83YA&amp;a=https%3A%2F%2Ft.me%2Fjoinchat%2FIj6yrkU2EnWDDQ1GgL83YA)   
**Steemit:** [https://steemit.com/@primetalentcoin/](https://c212.net/c/link/?t=0&amp;l=en&amp;o=2357298-1&amp;h=1007246726&amp;u=https%3A%2F%2Fsteemit.com%2F%40primetalentcoin%2F&amp;a=https%3A%2F%2Fsteemit.com%2F%40primetalentcoin%2F)"
1,2019-01-28,vastlinks,1,"Automated Trading and Artificial Intelligence: Interview with Viet Anh Pham, the CEO and founder of Win FX",[removed]
2,2019-01-27,SuchRush,1,What will the death of Facebook look like?," It's hard to see how it will die, but all things eventually do. Facebook is so integrated in so many facets of life, and it's only getting deeper with each day that passes. FB is beginning to make amazing hardware like Portal (yes portal is amazing tech) , and Oculus HMDs, and integrating it with the ecosystem. FB is 1st in virtual reality, 2nd in artificial intelligence (behind google), and somewhere in the top 4 for augmented reality, so you can bet the FB ecosystem will be integrated in the most important technologies that emerge over the next 10-30 years.

FB will officially become the place you visit your deceased family members/ancestors to reflect on their lives, so there will be emotional/historical attachment to the platform. The nature of the social media business is some what of a natural monopoly (or at least oligopoly), in that the value of the platform raises the more people that on there. Upcoming regulation will make it a lot more difficult for any would be start up to compete. What do you think?"
3,2019-01-23,agabeyjlcyk,1,SparkCognition and Global HITSS offer artificial intelligence solutions to advance digital transformation in various industries,"AUSTIN, Texas ,  Jan. 23, 2019  /PRNewswire/ --&amp;#xA0;Global HITSS, an Am&amp;#xE9;rica M&amp;#xF3;vil company, and SparkCognition announce a strategic alliance to expand the use of artificial intelligence applications in companies throughout 25 countries.          Global HITSS, a company dedicated ...
Read the whole news https://marketwirenews.com/news-releases/sparkcognition-and-global-hitss-offer-artificial-intelligence-solutions-to-advance-digital-transformation-in-various-industries-7517624.html 
"
4,2019-01-08,Gloryboy80,1,BOTZ etf prediction,"Recently bought an artificial intelligence etf (botz). What do you guys predict for the price per share for this etf 1 year,5 years, 10 years from now?"
5,2019-01-03,NineteenEighty9,1,The future might not belong to China: Replicating the success of other high-growth economies is about to become far harder,"[Link: article text below](https://www.ft.com/content/ae94de0e-0c1a-11e9-a3aa-118c761d2745)

Martin Wolf JANUARY 1, 2019 

Do not extrapolate from the recent past. China has had a hugely impressive four decades. After their triumph in the cold war, both the west and the cause of liberal democracy have stumbled. Should we conclude that an autocratic China is sure to become the world’s dominant power in the next few decades? My answer is: no. That is a possible future, not a certain one.

The view widely held in the 1980s that Japan would be “number one” turned out to be badly mistaken. In 1956, Nikita Khrushchev, then first secretary of the Communist party of the Soviet Union, told the west that “We will bury you!” He proved utterly wrong. The examples of Japan and the Soviet Union highlight three frequent mistakes: extrapolating from the recent past; assuming that a period of rapid economic growth will be indefinitely sustained; and exaggerating the benefits of centralised direction over those of economic and political competition. In the long run, the former is likely to become rigid and so brittle, while the latter is likely to display flexibility and so self-renewal.

Today, the fiercest political and economic competition is between China and the US. A conventional view is that by, say, 2040, China’s economy will be far bigger than that of the US, with India far smaller still. But might this view be mistaken? Capital Economics, an independent research firm, answers “yes”, arguing that China's period of stellar outperformance might be coming to an end quite soon. (See charts.)


There are two powerful arguments why this view will prove to be mistaken: first, China has great potential for continuing catch-up on the productivity levels of the most advanced countries; and, second, it has a proven ability to generate sustained rapid growth. It is brave to bet against both potential and capacity. But, argues Capital Economics, in its “Long-Term Global Economic Outlook”, we should. As with Japan in the 1980s, the policies of ultra-high investment and rapid debt accumulation, which kept China growing so fast after the 2008 financial crisis, make it vulnerable to a sharp deceleration.


Crucially, China’s investment rate, at 44 per cent of gross domestic product in 2017, is unsustainably high. This extraordinary investment rate did maintain the growth of supply and demand after the 2008 crisis. But China’s public capital stock per head is already far bigger than Japan’s at comparable incomes per head. Slowing urban household formation means that fewer new homes now need to be built. Not surprisingly, returns on investment have collapsed. In sum, investment-led growth must come to an early end.

Because of its size, China has also hit the buffers on export-driven growth, at a lower level of income per head than other high-growth east Asian economies. The trade war with the US underlines this reality. China’s working-age population is also declining. Given the huge rise in debt as well, sustaining fast growth will be very hard.


Future demand will depend on the emergence of a mass-consumer market, while growth of supply will require an upsurge in growth of “total factor productivity” — a measure of innovation. Yet, in 2017, private consumption was only 39 per cent of GDP. If it is to drive demand, the savings rate must tumble and the share of household incomes in GDP must jump. Neither will be easy to achieve. But the biggest hurdle of all, especially to the needed upsurge in productivity growth, is the shift towards a more autocratic political system.

For one and a half decades, China has benefited from the reforms introduced by Zhu Rongji, premier from 1998 to 2003. No comparable reforms have happened since his time. Today, credit is still being preferentially allocated to state businesses, while state influence over large private businesses is growing. All this is likely to distort the allocation of resources and slow the rate of innovation and economic progress, even if an outright financial crisis is avoided.

In sum, China may well fail to replicate the success of other east Asian high-growth economies, in becoming a high-income country in short order. It will surely be far harder for it to do so, because the distortions in its economy are so large and the global environment is going to be so much more hostile.


Meanwhile, suggests Capital Economics, the arrival of robotics and artificial intelligence might re-ignite productivity growth in the west and, above all, in the US. If one wished to be optimistic, one would also hope that experience of Donald Trump’s incompetence and malevolence will be salutary. His hardcore supporters are a minority. Majorities of the disgusted should win and then bring about the renewal of economic competition and social concern that the US needs.

The most interesting other economy is not Europe, which seems destined for a slow relative decline, but India, due to be the world’s most populous country in the near future. India is far poorer than China and so still has great potential for fast catch-up growth. Capital Economics forecasts 5-7 per cent annual growth until 2040. This is at least conceivable. India’s savings rates and entrepreneurial capacity are high enough to deliver such a rate. It will need much policy reform. But India’s politics are increasingly focused on economic performance. This does not guarantee success. But it does make it more likely.

Disheartened liberal democrats must not despair. The euphoria and hubris of the “unipolar moment” of the 1990s and early 2000s were grave mistakes. But the triumph of despotism is still far from inevitable. Autocracies can fail, just as democracies can thrive. China confronts huge economic challenges. Meanwhile, democracies must learn from their mistakes and focus on renewing their politics and policies.
"
6,2019-01-03,NineteenEighty9,1,The future might not belong to China: Replicating the success of other high-growth economies is about to become far harder,"[link, article text below](https://www.ft.com/content/ae94de0e-0c1a-11e9-a3aa-118c761d2745)

Martin Wolf JANUARY 1, 2019 

Do not extrapolate from the recent past. China has had a hugely impressive four decades. After their triumph in the cold war, both the west and the cause of liberal democracy have stumbled. Should we conclude that an autocratic China is sure to become the world’s dominant power in the next few decades? My answer is: no. That is a possible future, not a certain one.

The view widely held in the 1980s that Japan would be “number one” turned out to be badly mistaken. In 1956, Nikita Khrushchev, then first secretary of the Communist party of the Soviet Union, told the west that “We will bury you!” He proved utterly wrong. The examples of Japan and the Soviet Union highlight three frequent mistakes: extrapolating from the recent past; assuming that a period of rapid economic growth will be indefinitely sustained; and exaggerating the benefits of centralised direction over those of economic and political competition. In the long run, the former is likely to become rigid and so brittle, while the latter is likely to display flexibility and so self-renewal.

Today, the fiercest political and economic competition is between China and the US. A conventional view is that by, say, 2040, China’s economy will be far bigger than that of the US, with India far smaller still. But might this view be mistaken? Capital Economics, an independent research firm, answers “yes”, arguing that China's period of stellar outperformance might be coming to an end quite soon. (See charts.)


There are two powerful arguments why this view will prove to be mistaken: first, China has great potential for continuing catch-up on the productivity levels of the most advanced countries; and, second, it has a proven ability to generate sustained rapid growth. It is brave to bet against both potential and capacity. But, argues Capital Economics, in its “Long-Term Global Economic Outlook”, we should. As with Japan in the 1980s, the policies of ultra-high investment and rapid debt accumulation, which kept China growing so fast after the 2008 financial crisis, make it vulnerable to a sharp deceleration.


Crucially, China’s investment rate, at 44 per cent of gross domestic product in 2017, is unsustainably high. This extraordinary investment rate did maintain the growth of supply and demand after the 2008 crisis. But China’s public capital stock per head is already far bigger than Japan’s at comparable incomes per head. Slowing urban household formation means that fewer new homes now need to be built. Not surprisingly, returns on investment have collapsed. In sum, investment-led growth must come to an early end.

Because of its size, China has also hit the buffers on export-driven growth, at a lower level of income per head than other high-growth east Asian economies. The trade war with the US underlines this reality. China’s working-age population is also declining. Given the huge rise in debt as well, sustaining fast growth will be very hard.


Future demand will depend on the emergence of a mass-consumer market, while growth of supply will require an upsurge in growth of “total factor productivity” — a measure of innovation. Yet, in 2017, private consumption was only 39 per cent of GDP. If it is to drive demand, the savings rate must tumble and the share of household incomes in GDP must jump. Neither will be easy to achieve. But the biggest hurdle of all, especially to the needed upsurge in productivity growth, is the shift towards a more autocratic political system.

For one and a half decades, China has benefited from the reforms introduced by Zhu Rongji, premier from 1998 to 2003. No comparable reforms have happened since his time. Today, credit is still being preferentially allocated to state businesses, while state influence over large private businesses is growing. All this is likely to distort the allocation of resources and slow the rate of innovation and economic progress, even if an outright financial crisis is avoided.

In sum, China may well fail to replicate the success of other east Asian high-growth economies, in becoming a high-income country in short order. It will surely be far harder for it to do so, because the distortions in its economy are so large and the global environment is going to be so much more hostile.


Meanwhile, suggests Capital Economics, the arrival of robotics and artificial intelligence might re-ignite productivity growth in the west and, above all, in the US. If one wished to be optimistic, one would also hope that experience of Donald Trump’s incompetence and malevolence will be salutary. His hardcore supporters are a minority. Majorities of the disgusted should win and then bring about the renewal of economic competition and social concern that the US needs.

The most interesting other economy is not Europe, which seems destined for a slow relative decline, but India, due to be the world’s most populous country in the near future. India is far poorer than China and so still has great potential for fast catch-up growth. Capital Economics forecasts 5-7 per cent annual growth until 2040. This is at least conceivable. India’s savings rates and entrepreneurial capacity are high enough to deliver such a rate. It will need much policy reform. But India’s politics are increasingly focused on economic performance. This does not guarantee success. But it does make it more likely.

Disheartened liberal democrats must not despair. The euphoria and hubris of the “unipolar moment” of the 1990s and early 2000s were grave mistakes. But the triumph of despotism is still far from inevitable. Autocracies can fail, just as democracies can thrive. China confronts huge economic challenges. Meanwhile, democracies must learn from their mistakes and focus on renewing their politics and policies.

martin.wolf@ft.com
"
7,2019-02-14,ladybaybee,1,Ladybaybee's recommended stock picks for 2-14-2019,"[Link to imgur with a screenshot of my picks for the day](https://imgur.com/a/T09c9Yg)

I am not a financier or economist. I am electrical engineer with equal passion in artificial intelligence and financial markets. For the past 2 years I have been working on a system that would make short term predictions of stocks. The system is rather complex, I use multiple layers which include: Convolutional Neural Networks, LSTMs and Genetic Algorithms. All bulked together produce an output like in this image. The way to interpret the image is a follows: Symbol and Date columns are self explanatory, Quorum refers to autonomous agents that decide whether to BUY/NOT BUY or SELL/HOLD a stock. Each symbol has 9 agents, and the Quorum column, counts the number of agents that recommend Buy, Selling or Holding the stock. The “Not Owned” column means: if you don’t own this  stock then you should The “Owned” column means: if you own this stock you should HOLD or SELL. The column “Growth(90d)” refers to what what has been the growth of this system of Agents in the past 3 months. The column “Tx(90d)” shows the number of full transactions that these agents recommended in the last 3 months. “Factor” is just the division of Growth divided by Transactions to get the average growth per transaction. Finally “Success Rate” shows how successful these agents have been in their recommendations in the past 90 days, success 1 means 100% successful, 0.5 means 50% successful, and so on. 

Many people have been curious about the actual process that the system follows, so here it is: for every symbol (600 stocks are analyzed daily), we get the full stock data (open,close,high,low,volume) for the past 4 months. Each stock is associated with another set of “lookalike” stocks as well as major ETF’s. This initial dataset is run through a convolutional layer that extracts an undisclosed number of features. These features are then passed onto a recurrent neural network (LSTM) where sequences and patterns are extracted. The LSTM then spits out probabilities for the likelihood that this stock will have a positive, negative and neutral tendency in the next N days. These probabilities are then fed to a genetic evolution system (GES). This system essentially checks the predictions for the past N days and compares them with reality, following that the systems knows which predictions are performing the best. Once the system knows which stocks are being simulated the best, then the system automatically finds which of these best performing stocks have the biggest potential for the next few days. The system does not output explanations, unfortunately us humans are not capable of understanding (or visualizing) a problem of this dimensionality, for example the LSTM part alone works with over 10 million dimensions, not features but dimensions."
8,2019-03-19,chirpingbirdie,0,5 Artificial Intelligence Stocks to Consider,
9,2019-03-13,aturtlefromhongkong,1,"Curious about the use of algorithms and artificial intelligence as tools for decision making, aside from Renaissance Technologies what others can you can tell me about","I already know of one, an ETF that began in 2017. 

https://www.aieqetf.com

AIEQ and AIIQ "
10,2019-03-05,bennzo1238,33,"Research by investment firm MMC Ventures could not find any evidence of artificial intelligence applications at 40 per cent of 2,830 AI start-ups in Europe","Would recommend reading the whole article, core bits here:
&gt; 
&gt; 	Two-fifths of Europe’s artificial intelligence start-ups do not use any AI programs in their products, according to a report that highlights the hype around the technology.
&gt; 
&gt; The research by London-based investment firm MMC Ventures could not find any evidence, based on public information and interviews with executives, of artificial intelligence applications at 40 per cent of 2,830 AI start-ups in Europe.
&gt; 
&gt; Nevertheless, the companies are often described as AI-focused, said David Kelnar, MMC’s head of research, who added that many start-ups had plans to develop machine-learning programs, an application of AI that sees computers automatically learn and improve from experience, in the future.
&gt; 
&gt; Almost 8 per cent of European start-ups founded last year were AI companies, compared with about 3 per cent in 2015, MMC’s research showed, with the UK taking the lead. The UK has been home to some of the most high-profile AI businesses, which have been bought by foreign buyers, such as Google’s DeepMind, Microsoft’s SwiftKey and Twitter’s Magic Pony.

&gt;However, investors said the industry would have to cut through a growing frenzy around the sector. “Getting stuck in buzzwords is never a good thing,” said Simon Cook, chief executive of Draper Esprit. “AI has become a catch-all phrase that’s often used flippantly.”
&gt; "
11,2019-04-09,dayan_stocks,1,Leading Cannabis Companies to Embrace Artificial Intelligence (AI) to Significantly Boost Global Sales,[https://medium.com/@islandautoparts/leading-cannabis-companies-to-embrace-artificial-intelligence-ai-to-significantly-boost-global-81b6e70dad1](https://medium.com/@islandautoparts/leading-cannabis-companies-to-embrace-artificial-intelligence-ai-to-significantly-boost-global-81b6e70dad1)
12,2019-05-29,S-PRO_company,1,How to Get Rich by Investing Money in the Most Profitable Businesses,"People are always looking for ways to invest their money smart. Aren’t you one of those? Either way, you wouldn’t be on this page wondering how to get really rich with your own business. No worries, here you’ll realize what things you can do with the money amount already available in your pocket.

We’ve already seen in [our article](https://blog.s-pro.io/invest-money-business-become-millionaire/) what options are there for you when your goal is to earn some interest. Even more, those methods over time can bring really inspiring results for everyone. [In this piece of work](https://blog.s-pro.io/how-to-invest-money-business/), I've concentrated more on the last specified option – business. There are many reasons for that. Probably the most important one is that business can bring the biggest revenue out of all other investment options.

## What are the most profitable businesses?

There are uncountable possibilities in every niche. Just check out the empty cells in the Startup Matrix we already described in [our post](https://blog.s-pro.io/how-to-brainstorm-new-startup-ideas-the-startup-idea-matrix/). We can start listing the actual spheres that are in need of fresh new ideas. But to be of more help to you we better concentrate on the directions in businesses that can be applied to almost every business niche.

What unites every other direction is technology. It has already changed the way all businesses function around the world. There more or less progress here or there, but it is definitely the biggest trend nowadays.

Entrepreneurs are stepping into the tech world with joy because it has already proven the positive effect that tech inclusions do with businesses by scaling them with ease.

Artificial intelligence and machine learning will take away manual operations transforming the way industries will work within just a few years.

### Online business

People are getting more aware of the benefits of online transactions, communication systems and other online platforms offer. Have you considered how much more convenient it is to use contactless payments?

There were many challenges that online businesses have already overcome and continue successfully dealing with nowadays.

### Artificial Intelligence

There have been many debates around AI for years. Nowadays it gets more and more popular and is expected to bring new products with [AI implemented](https://blog.s-pro.io/ai-driven-development-as-an-innovative-market-tendency/) in 2019 and further years.

With AI data analytics will be on hype as artificial intelligence operates with behavioral data of each user.

### Blockchain

Even though the hype around blockchain has been decreased lately, it still has great potential in [transforming all the business niches and everyone’s lives](https://blog.s-pro.io/how-to-change-the-world-for-the-better-or-our-utopian-future-with-blockchain/). Due to its benefits where the major ones are anonymity, security and interchangeability it has already been implemented in a number of big projects and continues to be in demand.

These are just a few major trends that will rule the business world and continue to be implemented in all areas of our lives. The core feature that unites all of them is an online presence. The mobility it gives to consumers is much appreciated by them. People are getting to feel the benefits of not be tied up to a certain location.

What comes to your mind when you think about mobility? Possibly mobile devices and the growing number of various mobile applications already implemented and growing. The thing is all the mentioned trends can be implemented in businesses via web and mobile applications.

**So without further ado, we are concluding that the most profitable businesses will be for sure connected with the** [apps developed to serve](https://s-pro.io/en/) **the described needs thus attracting more and more audience to any product you already have or only have in mind.**"
13,2019-05-17,TomCTom,1,How to Invest in Artificial Intelligence (AI) Stocks and Startups?,"Investing in artificial intelligence stocks and startups can be a smart decision if you have a long term vision. However, you need to do some research before you invest in one of the stocks or startups. 

[https://www.allinallspace.com/how-to-invest-in-artificial-intelligence-ai-stocks-and-startups/](https://www.allinallspace.com/how-to-invest-in-artificial-intelligence-ai-stocks-and-startups/)"
