,created_utc,author,score,title,selftext
24,2019-11-11,beck2047,1,Google’s ‘Project Nightingale’ Gathers Personal Health Data on Millions of Americans,"[https://www.wsj.com/articles/google-s-secret-project-nightingale-gathers-personal-health-data-on-millions-of-americans-11573496790?mod=hp\_lead\_pos1](https://www.wsj.com/articles/google-s-secret-project-nightingale-gathers-personal-health-data-on-millions-of-americans-11573496790?mod=hp_lead_pos1) 

Google is engaged with one of the country’s largest health-care systems to collect and crunch the detailed personal health information of millions of Americans across 21 states.

The initiative, code-named “Project Nightingale,” appears to be the largest in a series of efforts by Silicon Valley giants to gain access to personal health data and establish a toehold in the massive health-care industry. [Amazon.com](https://Amazon.com) Inc., Apple Inc. and Microsoft Corp. are also aggressively pushing into health care, though they haven’t yet struck deals of this scope.

Google began the effort in secret last year with St. Louis-based Ascension, the second-largest health system in the U.S., with the data sharing accelerating since summer, the documents show.

The data involved in Project Nightingale encompasses lab results, doctor diagnoses and hospitalization records, among other categories, and amounts to a complete health history, including patient names and dates of birth.

Neither patients nor doctors have been notified. At least 150 Google employees already have access to much of the data on tens of millions of patients, according to a person familiar with the matter and documents.

Some Ascension employees have raised questions about the way the data is being collected and shared, both from a technological and ethical perspective, according to the people familiar with the project. But privacy experts said it appeared to be permissible under federal law. That law, the Health Insurance Portability and Accountability Act of 1996, generally allows hospitals to share data with business partners without telling patients, as long as the information is used “only to help the covered entity carry out its health care functions.”

Google in this case is using the data, in part, to design new software, underpinned by advanced artificial intelligence and machine learning, that zeroes in on individual patients to suggest changes to their care. Staffers across Alphabet Inc., Google’s parent, have access to the patient information, documents show, including some employees of Google Brain, a research science division credited with some of the company’s biggest breakthroughs.

In a press release issued after the Journal’s article was published, the companies said the project is compliant with federal health law and includes robust protections for patient data.

Tech giants like Amazon and Apple are expanding their businesses to include electronic health records -- which contain data on diagnoses, prescriptions and other medical information. That’s creating both opportunities and spurring privacy concerns. Here’s what to know. Photo Composite: Heather Seidel/ The Wall Street Journal

Google Cloud president Tariq Shaukat said in the release that the company’s goal in health care centers on “ultimately improving outcomes, reducing costs, and saving lives.”

“As the healthcare environment continues to rapidly evolve, we must transform to better meet the needs and expectations of those we serve as well as our own caregivers and healthcare providers,” said Eduardo Conrado, an executive vice president at Ascension.

Google and nonprofit Ascension have parallel financial motives. Google has assigned dozens of engineers to Project Nightingale so far, without charging for the work, because it hopes to use the framework to sell similar products to other health systems. Its end goal is to create an omnibus search tool to aggregate disparate patient data and host it all in one place, documents show.

The project is being developed under Google’s cloud division, which trails rivals like Amazon and Microsoft in market share. Google CEO Sundar Pichai has said repeatedly this year that finding new areas of growth for cloud is a priority.

Ascension, a Catholic chain of 2,600 hospitals, doctors’ offices and other facilities, aims in part to improve patient care. It also hopes to mine data to identify additional tests that could be necessary or other ways in which the system could generate more revenue from patients, documents show. Ascension is also eager for a faster system than its existing decentralized electronic record-keeping network.

Google, like many of its Silicon Valley peers, has at times drawn criticism for not doing enough to protect user privacy. Its YouTube unit agreed in September to pay $170 million in fines and make changes to its practices in response to complaints that it illegally collected data on children to sell ads. YouTube neither admitted nor denied wrongdoing.

Last year, The Wall Street Journal reported that Google hid a flaw that exposed hundreds of thousands of birth dates, contact information and other personal data of subscribers in its now-defunct social-networking website Google Plus, in part because of fears that the incident could trigger regulatory scrutiny. Google said at the time it went beyond legal requirements in determining not to inform users."
25,2019-12-18,Reverenter,1,"""During a gold rush, sell shovels.""","As the old saying goes, the most surefire method of profiting off of an emerging market is to enable others to seize the opportunity rather than trying your luck yourself. So in that spirit, I wanted to open up a discussion about emerging markets and the companies that enable them in hopes that our collective insight will point us towards profitable investments that we can all benefit from. 

Below is a list of the emerging markets that come to my mind. This certainly isn't exhaustive, so input of additional upcoming markets is appreciated. Just to reiterate, the goal isn't to speculate which companies will be the leaders in these areas (ex. NFLX for Streaming Services), but rather identify the companies who are best positioned to enable these industries as a whole (ex. ROKU for Streaming Services):

* Artificial Intelligence (AI) &amp; Artificial General Intelligence (AGI)
* 5G Wireless Networks
* SmartHome Devices &amp; IoT
* Meat Substitutes / Lab-grown meat products
* Satellite Internet
* Virtual Reality
* Cloud Infrastructure and Virtual Desktop Infrastructure (VDI)
* Drone Technology
* Streaming Services
* Electric Vehicles (EVs)

So what are some other markets you believe will explode over the next several years? What companies do you think are most likely to empower them?"
26,2019-12-06,neenzchi,1,2020 Investment Ideas,"I am thinking about short and long term investment ideas for 2020 and beyond and wanted to get your thoughts. So far, I think large cap dividend ETFs are a good investment given the uncertainty in the market, healthcare companies, data storage, and artificial intelligence. What are your thoughts on investments given market uncertainty?"
